{
  "$schema": "https://mobilebuildtools.com/schemas/v3/buildtools.schema.json",
  "artifactCopy": {
    "disable": false
  },
  "appConfig": {
    "strategy": "BundleAll"
  },
  "automaticVersioning": {
    "behavior": "PreferBuildNumber",
    "environment": "All",
    "versionOffset": 0,
    "disable": false
  },
  "css": {
    "minify": false,
    "bundleScss": false,
    "disable": false
  },
  "images": {
    "directories": [
      "Images\\Beta",
      "Images\\Shared"
    ],
    "conditionalDirectories": {
      "MonoAndroid": [ "Images\\Android" ],
      "Xamarin.iOS": [ "Images\\iOS" ]
    },
    "watermarkOpacity": null,
    "disable": false
  },
  "manifests": {
    "token": "$$",
    "variablePrefix": "Manifest_",
    "missingTokensAsErrors": false,
    "disable": false
  },
  "releaseNotes": {
    "maxDays": 7,
    "maxCommit": 10,
    "characterLimit": 250,
    "filename": "ReleaseNotes.txt",
    "createInRoot": true,
    "disable": false
  },
  "projectSecrets": {
    "E2EApp": {
      "disable": false,
      "delimiter": ";",
      "prefix": "BuildTools_",
      "className": "Secrets",
      "namespace": "Helpers",
      "properties": [
        {
          "name": "SampleString",
          "type": "String"
        },
        {
          "name": "SampleBool",
          "type": "Bool"
        },
        {
          "name": "SampleInt",
          "type": "Int"
        },
        {
          "name": "SampleDouble",
          "type": "Double"
        },
        {
          "name": "SampleUri",
          "type": "Uri"
        },
        {
          "name": "SampleMessage",
          "type": "String",
          "defaultValue": "Hello World!"
        }
      ]
    }
  },
  "debug": false
}