{
  "$schema": "https://mobilebuildtools.com/schemas/v3/buildtools.schema.json",
  "automaticVersioning": {
    "disable": true
  },
  "images": {
    "disable": true
  },
  "projectSecrets": {
    "E2E.Tests": {
      "prefix": "Test_",
      "properties": [
        {
          "name": "AString",
          "type": "String"
        },
        {
          "name": "AnInt",
          "type": "Int"
        },
        {
          "name": "ADouble",
          "type": "Double"
        },
        {
          "name": "ABool",
          "type": "Bool"
        },
        {
          "name": "AFloat",
          "type": "Float"
        },
        {
          "name": "ADate",
          "type": "DateTime"
        },
        {
          "name": "AStringArray",
          "type": "String",
          "isArray": true
        },
        {
          "name": "AUri",
          "type": "Uri"
        },
        {
          "name": "AppCenterSecret",
          "type": "String",
          "defaultValue": "default"
        },
        {
          "name": "SomeDefaultBool",
          "type": "Bool",
          "defaultValue": "null"
        }
      ]
    }
  },
  "debug": true
}
