{
  "$schema": "https://mobilebuildtools.com/schemas/v3/buildtools.schema.json",
  "appConfig": {
    "strategy": "TransformOnly",
    "disable": false
  },
  "artifactCopy": {
    "disable": false
  },
  "automaticVersioning": {
    "behavior": "PreferBuildNumber",
    "environment": "All",
    "versionOffset": 0,
    "disable": false
  },
  "css": {
    "minify": false,
    "bundleScss": false,
    "disable": false
  },
  "images": {
    "directories": [
      "images"
    ],
    "conditionalDirectories": {
      "ios": [
        "images\\ios"
      ],
      "android": [
        "images\\android"
      ]
    },
    "watermarkOpacity": null,
    "disable": false
  },
  "manifests": {
    "token": "$",
    "variablePrefix": "Manifest_",
    "missingTokensAsErrors": true,
    "disable": false
  },
  "releaseNotes": {
    "maxDays": 7,
    "maxCommit": 10,
    "characterLimit": 250,
    "filename": "ReleaseNotes.txt",
    "createInRoot": false,
    "disable": false
  },
  "projectSecrets": {
    "BuildToolsSample": {
      "className": "Settings",
      "namespace": "Helpers",
      "properties": [
        {
          "name": "Message",
          "type": "String"
        },
        {
          "name": "AppCenterId",
          "type": "String"
        },
        {
          "name": "Backend",
          "type": "Uri"
        },
        {
          "name": "ClientId",
          "type": "Guid"
        }
      ]
    }
  },
  "environment": {
    "defaults": {
      "AppId": "com.avantipoint.buildtoolssample"
    },
    "configuration": {
      "Debug": {
        "AppId": "com.avantipoint.buildtoolssampledev"
      }
    }
  },
  "debug": true
}
